{
  "id": "5661bf60-1130-4475-aa66-4eefd9b9a3fe",
  "companyName": "Careington International Corporation",
  "roleTitle": "Software Developer",
  "sourceName": "indeed.com",
  "sourceUrl": "https://www.indeed.com/viewjob?jk=f466bbf7d3abcc8f",
  "status": "Applied",
  "workMode": "Hybrid",
  "location": "7400 Gaylord Pkwy, Frisco, TX 75034",
  "salaryMin": null,
  "salaryMax": null,
  "jobDescription": "Careington International seeks a Mid Level Software Developer to develop software solutions using C#, .NET Core, and cloud architecture knowledge. The role involves translating business needs into technical requirements, defining development practices, and improving operations through systems analysis and innovation across multiple teams.",
  "requiredSkills": [
    "C#",
    ".NET (version 6 or higher)",
    "ASP.NET",
    "SQL Server",
    "Object-oriented programming",
    "Design patterns",
    "Agile development",
    "SCRUM",
    "Test case design",
    "MVC",
    "JavaScript",
    "Web Services",
    "HTML",
    "CSS",
    "Entity Framework",
    "Software Design",
    "Documentation",
    "Testing"
  ],
  "niceToHaveSkills": [
    "TDD (Test-Driven Development)",
    "HIPAA experience",
    "PCI experience",
    ".NET Framework",
    "JQuery",
    "Microservices",
    "Angular",
    "TFS",
    "XML",
    "LINQ",
    "Microsoft Azure",
    "Azure DevOps",
    "CI/CD",
    "Visio",
    "Excel",
    "Project Planning tools",
    "SQL Server database administration"
  ],
  "rawPageContent": "Software Developer\nCareington International Corporation\n3.4\n3.4 out of 5 stars\n7400 Gaylord Pkwy, Frisco, TX 75034\nHybrid work\n&nbsp;\nProfile insights\nHere’s how the job qualifications align with your profile.\nSkills\n\nTest case design\n\nDeveloping and maintaining backend systems\n\nApplication design\n\nSystem design\n\nDo you have experience in Test case design?\n&nbsp;\nLocation\nEstimated commute\n15 minutes from 3191 Medical Center Dr\nJob address\n7400 Gaylord Pkwy, Frisco, TX 75034\n&nbsp;\nFull job description\nFor more than 45 years, Careington International has been a leader in the health and wellness benefits space. Since its founding in 1979, Careington has been delivering dental discount solutions as its core competency. Today, Careington has expanded to offer a growing portfolio of 150+ health, wellness, lifestyle and virtual health products and services designed to deliver cost savings across a spectrum of life needs. Through its affiliated nationally licensed third-party administrator (TPA), Careington International also delivers full-scale administrative services, including customer service, licensed enrollment, claims administration, individual and group billing.\n\nWe are open to candidates that reside outside of the Dallas, TX but within Texas, Arizona, Florida, Alabama, North Carolina, or Nevada ONLY.\n\nWe are based in Frisco, TX\nWe are seeking a Mid Level Software Developer who is passionate about enabling a great member experience with emerging technologies to join our team. This position leads high-impact initiatives and drives innovation across multiple teams and ensures alignment with long-term business goals. You’ll help identify issues with the current architecture and determine how to evolve the current architecture in an incremental manner.\n\nYou will be hands-on with C# , .Net Core, and will need Cloud Architecture knowledge.\n\nPosition Overview & Responsibilities:\nDevelops software solutions by studying information needs; conferring with users; studying systems flow, data usage, and work processes; investigating problem areas; following the software development lifecycle. T\nTranslate and document business needs into technical requirements using deep dive sessions with business and technical teams.\nDefine standard development practices to follow and gate check development milestones for compliance.\nPrepares and installs solutions by determining and designing system specifications, standards, and programming.\nImproves operations by conducting systems analysis, recommending changes in policies and procedures.\nUpdates job knowledge by studying state-of-the-art development tools, programming techniques, and computing equipment, participating in educational opportunities; reading professional publications; maintaining personal networks; participating in professional organizations.\nProtects projects by keeping information confidential.\nProvide information by collecting, analyzing, and summarizing development and support issues.\nQualifications & Requirements:\n5+ years of practical experience as a .NET (version 6 or higher) Developer, both on front and back end.\nAdvanced knowledge of object-oriented concepts, design patterns and development processes\nGrounded understanding of iterative development practices, including Agile, SCRUM, etc.\nExperience developing test cases. TDD is a plus.\nExperience with regulated application development (HIPAA, PCI) are a plus.\nSkills & Abilities:\nTechnical knowledge includes: C#, ASP.NET, .NET Framework, SQL Server 2008 or newer programming (stored procedures, database design, etc.), MVC, JQuery, JavaScript, Web Services, Microservices, Angular, TFS, HTML, CSS, XML, LINQ & Entity Framework a plus\nExposure building native cloud applications in Microsoft Azure cloud is preferred\nHands on CI/CD experience using Azure DevOps is preferred\nProficiency with Visio, Excel, and Project Planning tools a plus, SQL Server database administration a plus\nTechnical abilities include Software Design, Documentation, and Testing, General Programming Skills, Software Development Fundamentals, Software Development Process, Software Requirements.\nEducation:\n\nBachelor's degree within Computer Science or related field",
  "points": 1,
  "createdDate": "2026-01-23T13:33:50.091744Z",
  "updatedDate": "2026-01-23T13:33:55.36261Z",
  "aiParsingStatus": "Success",
  "timelineEvents": [
    {
      "id": "83bae9cb-f1c9-457e-9f23-3ae26ca91747",
      "eventType": "Applied",
      "notes": "Application created",
      "timestamp": "2026-01-23T13:33:50.091744Z",
      "createdDate": "2026-01-23T13:33:50.091744Z"
    }
  ]
}